ID,Publication Year,Author,Title,Publication Title,DOI,1.1 Primary Stakeholders (SAMPLE),1.2 Context,1.3 Tech/AI type,1.4 Tool/Platform,1.5 Education level,2.1 Feedback term,2.1a Discussion points on the terminology,2.2 Description of context,2.3 Our evaluation,2.3a Discussion points for feedback process evaluation,3.1 Agency type,3.2 Feedback timing control,3.2a Discussion points for agency,4.1 Metrics for evaluation,4.2 Measurement of agency,Notes
18,2018,"Khodeir, N; Wanas, N; Elazhary, H",Constraint-based Student Modeling in Probability Story Problems with Scaffolding Techniques,INTERNATIONAL JOURNAL OF EMERGING TECHNOLOGIES IN LEARNING,10.3991/ijet.v13i01.7397,student,2-weeks practice,ITS,Math Story Problem Tutor,Senior high school 3, scaffolding feedback,,"Scaffolding is a type of support provided during the learning process. This support
is intended to be individualized to the specific requirements of the student with the
objective of helping the student achieve his/her learning goal","resenting a clue to the student by highlighting; general feedback that indicates whether the student answer is correct or incorrect, and whether there are any missing elements or incorrect elements is also indicated; visual hints",,"Student can control when to submit the answer, if show hints and choose to skip the question.",system control integrated human control by clicking show hints,,exam scores,not specified,
19,2018,"Inventado, PS; Scupelli, P; Ostrow, K; Heffernan, N; Ocumpaugh, J; Almeda, V; Slater, S",Contextual factors affecting hint utility,INTERNATIONAL JOURNAL OF STEM EDUCATION,10.1186/s40594-018-0107-6,students,assignment,Interactive learning environment,ASSISTments,"Middle school, G8",hint,,"help strategies, such as on-demand hint",offer corrections and explanations,,The hint will be presented directly without requirement. Student can choose if watch video in the hint.,system control,,"Mastery speed, Percent correct, Total answer-attempts, Total regular-hint count, Total bottom-out-hint count, Problems with hints, Attrition; Completion time, Total time-on-problem, Total time-between-problems, Winsorized total time-on-problem",not specified,
20,2023,"Tang, RY; Zhang, YY; Cao, Y; Liu, HY; Jia, JY",Design and Effect of Guided and Adaptive Tutoring Tips for Helping School Mathematics Problems Solving,,10.1007/978-3-031-35731-2_24,Students,Secondary school mathematics education.,Intelligent Tutoring System (ITS).,Mathematics Intelligent Assessment and Tutoring System (MIATS).,Senior high school.,"Adaptive feedback, hint",,Feedback is provided through intelligent hints and prompts based on students' responses.,"For each item, the system plan some steps to solve the problem. student will get hint in every step and jump to defferent step according to their choice.",,"after each step of the prompt, student were given a chance to correct
their answers,","not control, they will see the hint after choice","student can't see all the steps designed, they just can follow the system","Pretest and posttest scores, along with statistical analysis (ANCOVA).",not specified,
21,2018,"Hoch, S; Reinhold, F; Werner, B; Richter-Gebert, J; Reiss, K",Design and research potential of interactive textbooks: the case of fractions,ZDM-MATHEMATICS EDUCATION,10.1007/s11858-018-0971-z,Students,Classroom instruction using an interactive textbook.,Interactive textbook.,ALICE:fractions (interactive textbook).,Grade 6.,Immediate feedback.,,"Task-level Feedback is provided after students complete tasks, evaluating their input and offering explanations. 3 Graded assistance  is suitably generated for each task and can be accessed at any time while working on the exercise.","The feedback provided is immediate and tailored to the student's responses, which aligns with effective feedback principles.",1. claim Task-level feedback and set 3 graded assisstance according to (Reiss and Hammer 2013),Students are able to choose the order in which to work with the exercises and the number of tasks they complete in each widget,Students can control when they request assisstance.,,Time on task and task success.,Agency is measured through the choices students make in task completion and feedback requests.,
22,2026,"Kuo, BC; Bai, ZE; Lin, CH",Developing an AI learning companion for mathematics problem solving in elementary schools,COMPUTERS & EDUCATION,10.1016/j.compedu.2025.105463,Students and teachers.,Elementary school mathematics education.,Generative AI-based learning companion.,Taiwan Adaptive Learning Platform (TALP) and TALPer.,Fifth grade.,"Adaptive feedback, personalized prompts.",,"TALPer utilizes GPT-4o technology to generate personalized prompts and explanations, delivering tailored learning guidance based on TALP's knowledge structure and students' diagnostic test results.",The feedback provided by TALPer is structured and aims to foster deeper understanding through guided questioning rather than direct answers.,"1. implementation of a Socratic dialogue approach, encouraging students to engage in reflective thinking and problem exploration 2.  incorporates an additional instructional layer based on Pólya's problem-solving strategy to further scaffold students' learning",Self-directed learning and interaction with the AI.,Students have some control over when they receive feedback through their interactions with TALPer.,1. just consider AI question and Answer student and student question and answer student. lacking deeep analysis of the discourse content.,"Pre-test and post-test scores, statistical analysis (ANCOVA).",Agency is measured through the analysis of student interactions and engagement levels with TALPer during learning sessions.,
23,2025,"Xing, WL; Song, YY; Li, CL; Liu, ZF; Zhu, WD; Oh, HJ",Development of a generative AI-powered teachable agent for middle school mathematics learning: A design-based research study,BRITISH JOURNAL OF EDUCATIONAL TECHNOLOGY,10.1111/bjet.13586,Middle school students and teachers.,Authentic classroom settings for mathematics learning.,Generative AI-powered teachable agent.,ALTER-Math.,Middle school.,"Feedback, hints, and guidance.",,"Feedback is provided as students teach the agent, simulating a peer learning experience.","The feedback mechanism aligns with the learning-by-teaching approach, enhancing understanding through teaching.",,Students are teaching the AI agent.,Students control the timing of feedback through their interactions with the agent.,,"Pre- and post-knowledge tests, usability surveys, and qualitative feedback.",Agency is measured through students' ability to teach the agent and their reflections on the teaching process.,This is a very interesting paper on how students shift from passive learners to active instructors
24,2024,"Whalen, KA; Renkl, A; Eitel, A; Glogger-Frey, I",Digital re-attributional feedback in high school mathematics education and its effect on motivation and achievement,JOURNAL OF COMPUTER ASSISTED LEARNING,10.1111/jcal.12889,Students,High school mathematics classroom.,Computer-based learning software.,Bettermarks.,High school (grades 8-10).,Re-attributional feedback.,,"Feedback was provided after every third task, focusing on shifting students' attributions from ability to effort.","The feedback aims to improve students' attribution styles, particularly for low-performing students, but results showed limited effectiveness.",1. Re-attributional feedback is more elaborate than standard feedback and it give some rough suggestion for wrong anwer,Feedback is primarily controlled by the software.,Students do not control feedback timing; it is predetermined by the software.,,"Attribution styles, self-efficacy, mathematics self-concept, and learning outcomes.",Not specified; the study does not detail how agency is quantitatively measured.,
27,2025,"Güler, NK; Yildiz, B",Effectiveness and guidance of artificial intelligence chatbots in diagnosing exponential expression errors,JOURNAL OF EDUCATIONAL RESEARCH,10.1080/00220671.2025.2510387,students,teacher-led adhoc study,Commercial AI (LLM-based chatbot),ChatGPT-4 and Gemini,8th grade,feedback,,Lacks detail ,"Limited discussion on what feedback means, some criteria in relation to the interaction (mostly clasified as 'explanation') so I would call it explanatory feedback",,Not specified,,,,,
28,2018,"Bringula, RP; Fosgate, ICO; Garcia, NPR; Yorobe, JLM",Effects of Pedagogical Agents on Students' Mathematics Performance: A Comparison Between Two Versions,JOURNAL OF EDUCATIONAL COMPUTING RESEARCH,10.1177/0735633117722494,Students and pedagogical agents (PAs).,Classroom setting with the use of a web-based application for mathematics learning.,Intelligent Tutoring System (ITS) with a pedagogical agent (PA).,Personal Instructing Agent (PIA).,Grade 7 students.,Textual feedback and facial expressions.,,Feedback is provided through facial expressions and textual hints based on the correctness of students' answers.,"The feedback provided by the PA is both emotional (facial expressions) and instructional (textual hints), which enhances student engagement and learning outcomes.",multimodal feedback,Students interact with the PA but do not control its feedback timing.,Students do not control feedback timing; feedback is provided based on their actions.,,"Pretest and posttest scores, number of problems solved, time spent using the software, and number of hints used.",Not specified; the study does not detail how agency is quantitatively measured.,
29,2024,"Lu, KL; Hao, LX; Wang, IJ; Liu, AQ",Eighth Graders and a Math Intelligent Tutoring System: A Deep Neural Network Analysis,,10.1007/978-3-031-64312-5_5,Students,Classroom and online tutoring environment.,Intelligent Tutoring System (ITS) using deep neural networks.,ASSISTments.,Eighth grade.,Scaffolding and hints.,,Feedback is provided through a sequence of scaffolding questions and hints after a student's incorrect answer.,"The feedback provided through scaffolding is essential for enhancing problem-solving skills, but over-reliance on it can be detrimental.","ASSISTments uses principles from the theory on scaffolding and the zone of proximal development to support learners. When a student answers a question incorrectly, the system provides step-by-step hints as scaffolds before allowing them to move on. This structured feedback ensures that students engage with targeted guidance to address misconceptions and build understanding before progressing to the next item.",Students can request hints ,Students have some control over when they receive feedback by choosing to request hints.,"ASSISTments promotes student agency by providing scaffolded support within the learner’s zone of proximal development, enabling students to actively engage with problem-solving rather than passively receiving answers. The system offers hints and allows multiple retries, giving learners control over pacing and opportunities for self-correction. However, the paper emphasizes that agency is maximized when students use scaffolds strategically rather than relying on them excessively, as over-dependence can undermine independent learning.","Accuracy, recall, specificity, precision, F1 scores, and AUC scores.",Not specified.,"""our study oﬀers two major findings. First, the scaﬀolding process built in the ASSISTments is moderately eﬀective in assisting students to increase their ability of problem-solving. Second, we find that frequent helpseeking behaviors can weaken or even nullify the benefits of scaﬀolding support. In other words, when students actively learn from scaﬀolds they gain knowledge, whereas when they overly rely on the intelligent system, they lose the opportunity."" (p.45)"
30,2025,"Sarmiento, CP; Prudente, MS",Enhancing formative assessment in statistics through classroom action research,REFLECTIVE PRACTICE,10.1080/14623943.2025.2452558,Students and instructors in a higher education statistics class.,"A higher education statistics class during the COVID-19 pandemic, utilizing online learning modalities.",Learning Management System (LMS).,MyOpenMath.,Higher education (undergraduate).,"Immediate feedback, corrective feedback.",,"Formative assessments were administered asynchronously through the LMS, allowing students to practice statistical exercises and receive immediate feedback on their answers.","The feedback provided was immediate and corrective, which aligns with the purpose of formative assessment to enhance learning and understanding.",,Student cam have multiple attempts and asynchronous assessments.,"Yes, students controlled the timing of feedback by choosing when to attempt assessments.",,"Student reflections, average number of attempts, and time spent per attempt.",Agency was measured through student reflections on their learning experiences and their ability to manage their assessment attempts. + Behavioural indicators in the LMS + Teacher reflection in the CAR system,
31,2024,"Slobodsky, P; Durcheva, M; Kugel, L",Enhancing Students ' Preparation for Math Exams using the Advanced Features of the Halomda Platform,INTERNATIONAL JOURNAL FOR TECHNOLOGY IN MATHEMATICS EDUCATION,10.1564/tme_v31.1.03,Students and educators.,Classroom and exam preparation setting.,AI-assisted learning platform.,Halomda,College/University level.,"Active feedback, advice, comments.",,"Feedback is provided during problem-solving, with options for students to receive help from AI or other tools.",The feedback provided is interactive and aims to enhance understanding rather than just providing correct answers.,,Self-directed learning.,"Students can control when they seek feedback. Technically, they can choose what they want to do to correct their mistake, feedback options are chosen",,Improvement in self-efficacy and exam performance.,Not specified.,
32,2024,"Fang, Y; He, B; Liu, Z; Liu, SYY; Yan, ZH; Sun, JW",Evaluating the Design Features of an Intelligent Tutoring System for Advanced Mathematics Learning,,10.1007/978-3-031-64302-6_24,College students,Classroom setting for advanced mathematics learning,Intelligent Tutoring System (ITS),Xiaomai,College level,Automatic feedback,,"Automatic feedback is generated upon answer submission, displaying answer cor-
rectness, detailed solutions, KCs related to the question, and response time. When an
error occurs, a prompt is generated by the system, typically providing the step-by-step
solution and recommending KCs to learn.","The feedback provided is immediate and requires reflection on errors, but the effectiveness of error reflection is questioned.",,Student  can't skip the feedback and reflection,Students do not control feedback timing,No evaluation on students' reflection,"Number of correct answers, practice performance measures",Not specified,
33,2019,"Weltman, HR; Timchenko, V; Sofios, HE; Ayres, P; Marcus, N",Evaluation of an adaptive tutorial supporting the teaching of mathematics,EUROPEAN JOURNAL OF ENGINEERING EDUCATION,10.1080/03043797.2018.1513993,Students,Blended learning environment in a university mathematics course.,Adaptive Tutorial (AT) (ITS but presented as more flexible for the educator),Smart Sparrow Adaptive eLearning Platform (AeLP).,Third-year engineering students.,"Instant, adaptive feedback.",,"Feedback is provided instantly after student responses, guiding them to reflect on their answers.",The feedback is corrective and elaborative to help students understand their mistakes and improve their learning. ,,Student can choose to engage with the tutorial and control the pace and path of their learning,Students somewhat control the timing of feedback but they choose when to engage with the tutorial. ,,Examination marks and student confidence levels pre- and post-tutorial.,n/a,No guidance on when or how to work with help provided
34,2024,"Price, MD; Smith, E; Smith, RA",Exceptional Talent and Enthusiasm for Math: An Examination of Storylines Circulated by ChatGPT about Mathematical Learners,INTERNATIONAL JOURNAL OF EDUCATION IN MATHEMATICS SCIENCE AND TECHNOLOGY,10.46328/ijemst.4461,students,experiment,LLM,ChatGPT,"primary school, G5",feedback,,"The feedback included: 1) greeting, 2) opening praise, 3) discussed mathematical content (2-3 paragraphs), 4) worked-out solution (if it identified the answer as wrong), 5) closing praise (1-2 paragraphs), 6) offer of ongoing support, and 7) signature",The feedback was set a mathematical writing structure,,Student can decide what content to input,Student input the question,,"athematical
thinking, mathematical explanations, effort and overcoming challenges, future mathematical success, and racial
exceptionalism",not specified,
35,2023,"Cao, LJ; Grabchak, M; ACM",Experience Report on Using WeBWorK in Teaching Discrete Mathematics,,10.1145/3545945.3569857,Students and instructors.,Online teaching of discrete mathematics.,Online homework system.,WeBWorK.,Undergraduate.,Immediate feedback.,,"Feedback is provided through auto-graded problems, allowing students to receive immediate responses to their answers.","not introduce the feedback type, no feedback before attempts reach instructors' setting.",,"Students can attempt problems multiple times and receive feedback.  The instructor can choose what to provide and when to provide it. For instance, a hint may appear after a certain number of attempts,
while a solution is typically provided after the ssignment is due.",Student can't control. Instructor can set a hint to appear after a certain number of attempts,Student can't choose when to have the hint according to their personal need.,Student performance metrics include final numerical grades and survey responses.,Agency is measured through student feedback on their ability to attempt problems multiple times and their perceived control over learning.,
37,2025,"Zhou, RJ; He, XL; Fan, Q; Li, YY; Li, Y; Xiao, X; Fang, J",Exploring ChatGPT-Facilitated Scaffolding in Undergraduates' Mathematical Problem Solving,JOURNAL OF COMPUTER ASSISTED LEARNING,10.1111/jcal.70077,Students,The study was conducted in a 'Combinatorics' course at a university in central China.,"ChatGPT, an AI-based chatbot.","Xiaoya, an educational platform that integrates ChatGPT.",Undergraduate level.,ChatGPT-Facilitated Scaffolding,,"The feedback is provided through a scaffolding framework that includes task description, heuristic mentoring, and question prompts, facilitating various stages of mathematical problem solving.","The feedback provided by ChatGPT is designed with Socratic questioning to promote critical thinking and deeper engagement with mathematical problems, moving beyond simple answer provision.",,Student can choose when to click AI helping button,Students have control over when they seek feedback from ChatGPT during the problem-solving process.,,"Performance data, interaction analysis, and self-reported surveys were used to assess both quantitative and qualitative aspects of students' experiences.",Agency is measured through the analysis of students' interactions with ChatGPT and their reflections on the problem-solving process.,
38,2020,"Bringula, R; Fosgate, IC; Yorobe, JL; Garcia, NP",Exploring the Sequences of Synthetic Facial hxpressions and Type of Problems Solved in a Personal Instructing Agent using Lag Sequential Analysis,,10.1109/TALE48869.2020.9368492,Students,Classroom,Intelligent Tutoring System (ITS),Personal Instructing Agent (PIA),Grade 7,Hints,,"Feedback is provided based on the correctness of steps in solving algebra problems, with emotional expressions from the agent influencing student responses. (A happy SFE is exhibited when students solved a step correctly while a sad reaction is exhibited for every mistake in the solution. A surprised SFE is displayed when a wrong answer is supplied after two consecutive correct answers or when a correct answer isgiven after incorrect answers.)",feedback is muitimodal.,,Not specified,Students can't control,,"Number of problems solved, levels of difficulty, and emotional responses of the agent.",Not specified (Most of the easy problems were solved while most of the average and difficult problems were not completed. More than one-third of the students attempted to solve an average problem (35%) while a very small portion of difficult problems are solved.),
39,2024,"Cheng, L; Croteau, E; Baral, S; Heffernan, C; Heffernan, N",Facilitating Student Learning With a Chatbot in an Online Math Learning Platform,JOURNAL OF EDUCATIONAL COMPUTING RESEARCH,10.1177/07356331241226592,Middle and high school students. [USA],Online math learning platform. [ not clear if it was used during lessons or for homework],Chatbot.,ASSISTments.,Middle and high school.,"Hints, scaffolding.",,"The chatbot provides interactive and personalized support through a series of scaffolded questions and hints. [chatbot is designed based on principles of scaffolded learning and constructivitist learning, p.694]","The feedback provided by the chatbot is scaffolded and aims to guide students through problem-solving, but the effectiveness in improving learning outcomes was not statistically significant.","The chatbot provides interactive, scaffolded feedback to guide students through complex math problems. When an incorrect answer is given, it offers targeted hints, breaks the problem into manageable steps, and addresses misconceptions to support conceptual understanding. Its feedback is formative and empathetic, acknowledging student effort, reducing anxiety, and encouraging persistence. Additionally, the chatbot uses a simple scoring system to identify errors and misconceptions, delivering corrective guidance aligned with pedagogical principles of constructivist and scaffolded learning.",Sstudents can somewhat control the problem solving process and request hints and step-by-step guidance. ,Students can control when they request hints.,"The chatbot promotes student agency by giving learners control over their problem-solving process through interactive scaffolding, on-demand hints, and step-by-step guidance. It encourages persistence by requiring completion of subtasks before moving on, supports metacognition by helping students identify what they know and need to learn, and provides empathetic feedback to reduce anxiety and foster independence. These features enable students to actively engage, make choices, and manage their own learning rather than passively receiving answers.","Student math performance, perceived helpfulness, interest, and confidence.",Agency is measured through students' ability to request hints and their responses to open-ended questions about their experiences.,"""The results revealed no significant differences in students’ math learning performance and perceived helpfulness and interest between the chatbot and traditional hints conditions. However, students in the chatbot condition displayed significantly lower confidence in solving a similar problem after the intervention, likely due to the removal of the high level of support provided by the chatbot. Despite this, students’ open responses indicated that a significantly higher number of students had positive attitudes towards chatbots. They appreciated the chatting feature, breaking down a problem into steps, and real-time support."" (Abstract, p.687)"
40,2025,"Li, XF; Zappatore, M; Li, TS; Zhang, WW; Tao, SN; Wei, XQ; Zhou, XX; Guan, NQ; Chan, AY",GAI Versus Teacher Scoring: Which is Better for Assessing Student Performance?,IEEE TRANSACTIONS ON LEARNING TECHNOLOGIES,10.1109/TLT.2025.3572518,Students,Online education.,"Generative Artificial Intelligence (GAI), specifically Generative Pretrained Transformer (GPT) models.","GPT-4, GPT-4o, and a customized Trained-GPT model.",Grade 12 (high school).,feedback,,"based on curriculum documents and teachers' working historical data, set predefined rubrics and provide students with timely feedback as well as personalized feedback.",feedback rely on the machine learning on teachers' past feedback. No consider on specific type or strategy.,,Feedback is primarily controlled by the GAI system.,Not specified.,,Not specified.,Not specified.,"The study is about the tool development, it use grading accuracy, consistency with human evaluators, and adaptability across subjects to evaluate the system."
