ID,Publication Year,Author,Title,Publication Title,DOI,1.1 Primary Stakeholders (SAMPLE),1.2 Context,1.3 Tech/AI type,1.4 Tool/Platform,1.5 Education level,2.1 Feedback term,2.1a Discussion points on the terminology,2.2 Description of context,2.3 Our evaluation,2.3a Discussion points for feedback process evaluation,3.1 Agency type,3.2 Feedback timing control,3.2a Discussion points for agency,4.1 Metrics for evaluation,4.2 Measurement of agency,Notes
62,2025,"Smith, H; Ottmar, E; Ngo, V; Closser, AH; Chan, JYC; Vanacore, K; Sales, A",Math Problem Supports in an Authentic Classroom Context: Unpacking the Effect of Immediate Feedback and Re-Attempts in Online Problem Sets on Middle School Students' Math Achievement,JOURNAL OF RESEARCH ON EDUCATIONAL EFFECTIVENESS,10.1080/19345747.2025.2534377,Students,Online problem sets in a classroom setting.,Intelligent Tutoring System (ITS).,ASSISTments.,Middle school (7th grade). (USA),"Immediate feedback, delayed feedback, hints.",,Iimmediate feedback and hints with reattempts. Delayed feedback as correctness feedback delivered immediately after the assignment completion,"Immediate feedback may improve accuracy but limit the number of problems completed, leading to mixed effects on overall learning outcomes.","The ASSISTments platform provides two feedback modes. In the immediate feedback with hints and reattempts condition, students receive instant correctness feedback after each attempt and can request up to four hints per problem. They must enter the correct answer before moving on, earning full credit if correct on the first try without hints, and partial credit with deductions for errors or hint use. After completing the set, students receive a second round of feedback and can review hints and correct answers. In contrast, the delayed feedback condition offers no hints or correctness feedback during problem-solving; students simply submit answers and proceed. After finishing, they access a session report with correctness feedback and hints, allowing them to revisit problems and review solutions.",Students can request hints but must answer correctly before proceeding.,Students do not control feedback timing; feedback is provided immediately after attempts.,"ASSISTments promotes student agency by giving learners control over their problem-solving process through the ""immediate feedback and hints with reattempts"" feedback condition. Students can request hints at any time, receive instant correctness feedback after each attempt, and retry problems until they reach the correct solution, which encourages persistence and self-regulation. The platform also provides detailed session reports that allow students to review their performance and revisit problems, supporting reflection and independent learning. These features enable students to actively monitor their progress, make decisions about when to seek help, and take ownership of improving their accuracy—key components of agency in learning.","Posttest scores, state test scores, percentage of problems completed, and percentage of problems answered correctly on the first attempt.",Not specified.,"""we examined whether the availability of immediate feedback with problem re-attempt, compared to delayed feedback on practice problem sets led to higher learning on math posttest achievement or state standardized assessments. Next, we examined if the availability of immediate hints and feedback on practice problem sets led to higher performance as measured by the percentage of problems completed or accuracy on problems compared to delayed feedback. Third, we examined if performance during practice mediated the effects of immediate feedback and hints with reattempts on math achievement and learning."" (abstract)"
63,2025,"Thompson, T; St John, J; Pradhan, S; Ottmar, E",MathFlowLens Dashboard: Co-Designing Teacher Orchestration Tools to Engage in Discourse Around Students' Mathematical Strategies,JOURNAL OF COMPUTER ASSISTED LEARNING,10.1111/jcal.70025,Teachers and students.,Classroom setting focused on online math problem-solving.,Data analytics and visualisation tool.,MathFlowLens Dashboard.,Middle and high school.,Actionable feedback.,,Feedback is provided through visualisations of student problem-solving pathways and strategies.,The feedback provided is actionable and designed to enhance teacher understanding of student strategies.,,n/a,Teachers control the timing of feedback based on student interactions.,,"Metrics include average number of attempts, errors, and efficiency scores.",Agency is measured through teachers' ability to interpret data and make informed decisions.,This is a good example of teachers taking major control in the feedback process - does this strip away student agency? …
64,2021,"Reinhold, F; Hoch, S; Schiepe-Tiska, A; Strohmaier, AR; Reiss, K","Motivational and Emotional Orientation, Engagement, and Achievement in Mathematics. A Case Study With One Sixth-Grade Classroom Working With an Electronic Textbook on Fractions",FRONTIERS IN EDUCATION,10.3389/feduc.2021.588472,Students,Classroom setting using an electronic textbook.,Electronic textbook (e-textbook).,ALICE: fractions project e-textbook.,Sixth grade.,"Adaptive feedback, exploratory feedback.",,Feedback is provided through an e-textbook that offers hints  based on student interactions on items.,"The feedback provided is immediate, including correction and explanation.",,Not specified,System give feedback when students submit the answer,,"Cognitive learning outcomes measured through pretests and posttests, along with engagement metrics from process data.",Agency is measured through self-reports on perceived autonomy support and engagement metrics from the e-textbook interactions.,
65,2024,"Perini, N; Porru, A; Moeller, K; Jay, T; Lucangeli, D; Sella, F",Number Express: A Digital Game to Improve Early Numeracy,ELECTRONIC JOURNAL OF E-LEARNING,10.34190/ejel.22.10.3522,Students,The context is a pilot study conducted in a separate room where preschool children played the game in small groups.,The technology used is a digital game designed for early numeracy skills.,The specific platform mentioned is a desktop PC and a tablet.,"The participants are preschool children, specifically those in their last kindergarten year.",feedback,,"The feedback mechanism involves visual and verbal messages when players make incorrect responses, along with a number line that appears to assist in ordering numbers correctly.",the feedback is not clearly say the problem,,Not specified,Students do not control the timing of feedback; it is provided automatically based on their responses.,,"Metrics used to evaluate the results of feedback effects include learnability, memorability, effectiveness, errors, self-corrections, and efficiency.","Agency is measured through children's ability to choose characters, levels, and their interaction with the game features.",
66,2025,"Portillo, R; Alvarado, A",Plenary: The Impact of AI Tools on Student Learning in Integral Calculus: A Case Study of Latin American Students,,10.1109/EDUNINE62377.2025.10981379,Students,Classroom and academic settings.,"AI tools, specifically ChatGPT.",ChatGPT.,Undergraduate engineering students.,Real-time feedback.,,Feedback is in ChatGPT's reply,The feedback is not designed with specific prompt,,"AI users viewed AI as a tool that accelerated learning, while non-users emphasized the loss of autonomy.","Not control, AI will reply as send some content","Some students showed psychological dependence, but it doean't mean they agree the loss of autonomy.",Student perceptions and reliance on AI tools.,Agency is measured through student reliance on AI and their perceptions of autonomy.,
67,2023,"Feng, MY; Huang, CW; Collins, K",Promising Long Term Effects of ASSISTments Online Math Homework Support,,10.1007/978-3-031-36336-8_32,Students and teachers,Classroom and homework assignments.,AI-based formative assessment platform.,ASSISTments.,7th grade.,"Immediate feedback, hints, scaffolds.",,"Correctness feedback is provided immediately after students enter their answers, with hints available for improvement.","The feedback provided is immediate and corrective, aimed at enhancing student understanding and performance.","ASSISTments provides students with immediate correctness feedback after entering answers and offers step-by-step hints to guide improvement or break down multi-step problems. It includes mastery-oriented “Skill Builders,” where students practice targeted skills until reaching a teacher-defined proficiency threshold (e.g., a streak of 3 correct answers). Additionally, the platform uses spaced practice, automatically revisiting previously mastered skills at intervals to reinforce learning and promote long-term retention.",Control over homework and practice activities through interactive features and monitor progress,Students do not control feedback timing; feedback is provided immediately after answer submission.,"ASSISTments promotes student agency by giving learners control over their homework and practice through interactive features. Students receive immediate feedback on correctness and can access hints or scaffolds to improve answers or break down multi-step problems, enabling self-correction and persistence. Mastery-oriented “Skill Builders” allow students to work toward teacher-defined proficiency thresholds at their own pace, while spaced practice revisits previously mastered skills to strengthen retention. Additionally, students can review performance reports and revisit problems, fostering reflection and self-regulation. These elements empower students to monitor progress, make decisions about when to seek help, and take ownership of achieving mastery rather than passively completing assignments.",State standardized Grade 8 EOG math assessment scores.,Not specified.,
68,2025,"Fang, JW; Guo, XG; Meng, XP; Hwang, GJ; Tu, YF","Realization of parasocial interaction theory in STEAM education with an AI pedagogical agent: insights from learning performance, collaboration tendency, and problem-solving tendency",INTERACTIVE LEARNING ENVIRONMENTS,10.1080/10494820.2025.2508326,Students,Junior high school STEAM education course.,AI pedagogical agent (AIPA).,AIPA learning system.,Junior high school.,"Timely, personalized feedback.",,Feedback is provided through interaction with the AIPA during project-based learning activities.,Not clear what feedback is provided. Looks like is based on evaluation through rubrics of various aspects of the project.,Example of black box feedback not clear ,Somewhat autonomous exploration and problem-solving.,Students can seek feedback from AIPA as needed during the learning process.,Availability of immediate feedback on problem of student choice might relate to increased motivation ,"Learning performance, problem-solving tendency, and collaboration tendency.",Agency is measured through students' interactions with AIPA and their ability to adjust their problem-solving strategies.,
69,2023,"Adair, A; Sao Pedro, M; Gobert, J; Segan, E",Real-Time AI-Driven Assessment and Scaffolding that Improves Students' Mathematical Modeling during Science Investigations,,10.1007/978-3-031-36272-9_17,student,classroom, Inquiry Intelligent Tutoring System virtual labs,,middle school， G8,scaffolding,,The automated scaffolding appears as an on-screen pop-up message delivered from a pedagogical agent,"1. The feedback give progressive explaination and guidance. 2. students can change answer after feedback, and the system will give different feedback based on student answer and feedback times.",,Student choice on fading pop-ups and going back to change answer,"system control (if wrong, pop up)",,modelling competencies,not specified,
71,2024,"Borchers, C; Wang, YY; Karumbaiah, S; Ashiq, M; Shaffer, DW; Aleven, V; Assoc Computing Machinery",Revealing Networks: Understanding Effective Teacher Practices in AI-Supported Classrooms using Transmodal Ordered Network Analysis,,10.1145/3636555.3636892,Teachers,Classroom setting with AI-based tutoring systems.,AI-based tutoring system for equation-solving.,Lynnette (intelligent tutoring system).,7th grade.,"step-wise error feedback, Hints",,"Feedback is provided through the AI tutor during problem-solving practice, with teacher visits influencing student behavior.",Primarily procedural feedback and hints (rather than developing conceptual understanding),"When talking about teachers' role we can bring this in as a good example of evidence "" teacher practices are associated with the efficacy of tutored problem-solving as measured in learning rate "". They reflect of course that is not clear whether teachers have time, attention to change their practices and if that would make a difference ",Students can choose when to get hints. Limited choice on when teacher support.,"Students control timing of hints, other correctness feedback is provided based on interactions with the AI tutor. Timing of teacher feedback determined by them.",Importance of 'teaching' moments on how to enange and by providing conceptual support vs just advancing without  learning,"Learning rates, hint requests, correct attempts.",,
73,2025,"Merrick, M; Fyfe, ER",Should I stay or should I go? Children's motivation in response to feedback and its association with math anxiety and math self-concept,CONTEMPORARY EDUCATIONAL PSYCHOLOGY,10.1016/j.cedpsych.2025.102393,Students (elementary school children),Classroom setting (computer game),Game-based learning,Not specified,Elementary school (6 to 8 year olds),Corrective feedback,,"Feedback was provided trial-by-trial, including knowledge of results (KR) and knowledge of the correct response (KCR), with the option to stop the game after each level.",KR was verification cue indicating right or wrong. KCR was just the correct reponse (not clear if it contained an explanation or adapted to the error of the student for example),"The paper suggests that feedback influences motivation, with negative feedback leading to decreased motivation, especially in children with high math anxiety or self-concept.",Student could choose to continue or stop the game.,Students got feedback after each item ,"Interesting  for thinking about when not to continue or use technology and how this relates to motivation, math anxiety",Task motivation (number of levels completed) and resilience (choice to continue despite negative feedback),Agency was measured through children's in-the-moment decisions to continue or stop the task.,
74,2021,"Kooken, JW; Zaini, R; Arroyo, I","Simulating the dynamics of self-regulation, emotion, grit, and student performance in cyber-learning environments",METACOGNITION AND LEARNING,10.1007/s11409-020-09252-6,Students and teachers.,Classroom (not very clear) using intelligent tutoring system.,Intelligent Tutoring System (ITS).,MathSpring.,Middle school (grades 6-7).,"Hints, scaffolding, feedback.",,"Feedback is provided through hints and scaffolding during problem-solving, with emotional states influencing the learning process.",The feedback provided is adaptive and aims to support student learning by addressing both cognitive and emotional needs.,,Students can seek help and making choices during learning.,Students have some control over when they receive feedback by requesting hints.,,"Success, mastery, hints, time spent on problems.",Agency is measured through the ability to request hints and the impact of emotional states on learning outcomes.,
76,2021,"Bush, JB",Software-based intervention with digital manipulatives to support student conceptual understandings of fractions,BRITISH JOURNAL OF EDUCATIONAL TECHNOLOGY,10.1111/bjet.13139,Students and teachers.,Classroom setting.,Intelligent Tutoring System (ITS) with adaptive features.,Woot Math Adaptive Learning (WMAL).,4th and 5th grade.,"Task feedback, process-oriented feedback, dynamic feedback.","The term “feedback” is used in its formal educational sense, grounded in Hattie & Timperley’s influential framework (task-level, process-level, and manipulative-based dynamic feedback), all supported by empirical research on their effectiveness for conceptual understanding.","Feedback is provided through task responses, adaptive videos, and dynamic manipulatives.",The feedback provided is diverse and aims to enhance both task performance and conceptual understanding.,,"Students can control pacing and response (retry, skip, or move on), choose to engage with adaptive hints/videos, actively manipulate representations to generate feedback loops.",Students have some control over feedback timing through their interactions with the software.,"Student agency is evident: control pacing and response (retry, skip, or move on), choose to engage with adaptive hints/videos, actively manipulate representations to generate feedback loops.","Assessment scores from pre-, mid-, and post-assessments.",Agency is measured through the adaptive responses and feedback provided based on student performance.,
77,2025,"Oppmann, MM; Beege, M; Reinhold, F",Stimulating individual learning of the concept of fraction equivalence: How students utilize adaptive features in digital learning environments mediates their effect,LEARNING AND INSTRUCTION,10.1016/j.learninstruc.2025.102118,students (primary/secondary?),regular class,adaptive digital learning,anonymous,"Secondary, grade 6?","Individualized feedback, explanatory feedback, corrective feedback.",,"Feedback is provided based on students' performance in real-time, adjusting task difficulty and offering explanations for errors.",Students who use feedback as designed benefit more in terms of learning gains.,,students can control their learning pace and task selection.,Feedback in response to their interactions with the tasks.,,"Performance scores on fraction tasks, engagement metrics derived from process data.",Students' self-reported perceptions of competence and autonomy during the learning process.,
80,2020,"Ruan, S; He, JY; Ying, R; Burkle, J; Hakim, D; Wang, A; Yin, YF; Zhou, L; Xu, QY; AbuHashem, A; Dietz, G; Murnane, EL; Brunskill, E; Landay, JA; ACM",Supporting Children's Math Learning with Feedback-Augmented Narrative Technology,,10.1145/3392063.3394400,Students (children in grades 3-5) and teachers.,"Classroom setting, specifically a lab study environment.",Narrative-based learning platform with a tutoring chatbot.,Unnamed hint system and 'Wizard-of-oz' prototype chatbot ,Elementary education (grades 3-5).,Hints and chatbot-mediated feedback.,"Feedback is conceptualised as interactive, personalized, and socially engaging, contrasting with static hints. It references Hattie, ICAP framework and social learning theory.",Feedback is provided through hints and a chatbot during a narrative-based math task.,"The feedback provided is interactive and personalized, enhancing engagement and learning outcomes.",,Student interaction with the chatbot and choice in the narrative.,Students have some control over when they receive feedback through the hint system and chatbot interactions.,"Students control help-seeking, interact socially, and co-construct learning through dialogue.","Learning outcomes assessed through pre- and post-study quizzes, engagement measured via the User Engagement Scale.",Agency is measured through the interaction frequency with the chatbot and the choices made during the narrative.,
81,2018,"Confrey, J; Maloney, AP; Belcher, M; McGowan, W; Hennessey, M; Shah, M",The concept of an agile curriculum as applied to a middle school mathematics digital learning system (DLS),INTERNATIONAL JOURNAL OF EDUCATIONAL RESEARCH,10.1016/j.ijer.2018.09.017,The primary stakeholders in this study are middle school teachers and students.,The context of the study is middle school classrooms where the Math-Mapper 6â€“8 digital learning system is implemented.,The technology used is a digital learning system (DLS) specifically designed for mathematics education.,The specific tool mentioned is Math-Mapper 6â€“8.,The education level of the participants is middle school.,"The terms used for feedback include ""immediate feedback,"" ""short-cycle feedback,"" and ""long-cycle feedback.""","Feedback is conceptualised as short-cycle feedback (during instruction) and long-cycle feedback (retrospective, for curricular revision). Both cycles rely on diagnostic assessment data.","Feedback is provided through diagnostic assessments that are linked to learning trajectories, allowing for immediate adjustments in instruction based on student performance.","The feedback provided is actionable and designed to help students identify gaps in their understanding, thus promoting a growth mindset.",,Sstudents are involved in interpreting their assessment data and making decisions about their learning.,Students have some control over the timing of feedback as they can access their assessment data and reflect on their understanding at their own pace.,"students interpret data, choose practice, revise answers, and collaborate on next steps.",Metrics for evaluation include student performance on diagnostic assessments and the use of heatmaps to visualize class performance.,Agency is measured through students' ability to reflect on their assessment data and their participation in discussions about their learning needs.,
82,2024,"Liu, HY; Zhang, YY; Jia, JY",The Design of Guiding and Adaptive Prompts for Intelligent Tutoring Systems and Its Effect on Students' Mathematics Learning,IEEE TRANSACTIONS ON LEARNING TECHNOLOGIES,10.1109/TLT.2024.3382000,Students and teachers.,High school mathematics education.,Intelligent Tutoring System (ITS).,MIATS V2.0 (Mathematics Intelligent Assessment and Teaching System).,High school.,Guiding and adaptive prompts.,"Prompt is the forefront focus for this paper, specifically on how to design for effective feedback. Personalisation and adaptive feedback through effective prompting is the key contribution.",Feedback is provided through a series of guiding and adaptive prompts during problem-solving tasks in mathematics.,"The feedback provided is personalized and adaptive, aimed at improving student performance in mathematics through tailored prompts.",,Student agency is present as students engage with prompts and make choices in their learning process.,Students have some control over the timing of feedback as they progress through the prompts at their own pace.,,"Pretest and posttest scores, time taken to complete tasks, and log data from the ITS.",Agency is measured through the analysis of students' engagement with the prompts and their ability to navigate their learning paths.,Prompt engineering is a big piece for this one
83,2023,"Lomos, C; Seineke, U; Kesting, F; Luyten, JW",The Design of Incentive Systems in Digital Game-Based Learning: How Primary School Children Interact with It,EDUCATION SCIENCES,10.3390/educsci13070668,Primary school children (students) and teachers.,"The study was conducted in two primary schools in Luxembourg City, focusing on students' interactions with a digital game-based learning item.",Digital game-based learning (DGBL) with eye-tracking technology.,"MathleTIC, a digital mathematics game.",Primary school (ages 8-11).,Performance feedback.,,"Feedback is provided at the end of the game, summarizing performance and indicating the number of stars earned.","The feedback is primarily summative, lacking elaboration on how to improve performance, which may limit its effectiveness for low-performing students.",,Sudents can see their performance but do not control the timing of feedback.,Students do not control the timing of feedback; it is provided at the end of the game.,"Students choose paths, engage in metacognitive reflection, and receive personalised support.",The number of stars earned and performance level achieved.,Agency is measured through students' self-reported perceptions and their interactions with the game elements.,
84,2025,"Khazanchi, R; Di Mitri, D; Drachsler, H",The Effect of AI-Based Systems on Mathematics Achievement in Rural Context: A Quantitative Study,JOURNAL OF COMPUTER ASSISTED LEARNING,10.1111/jcal.13098,Students and teachers.,Rural schools in the Southern United States.,AI-based system.,Edmentum Exact Path.,8th grade.,Immediate feedback.,"“Built-in feedback of Edmentum Exact Path provides hints to solve problems, helping students return to cognitive equilibrium and remain engaged.” - this paper connects the AI system to student engagement and connection to learning, none specific to the 'feedback' itself","Feedback is provided through diagnostic assessments and progress checks, with students receiving hints and additional tasks based on their performance.","The feedback provided is personalized and adaptive, aimed at addressing individual learning gaps.",,"Students control pace, interact with adaptive feedback and earn mastery rewards.","Yes, students control feedback timing.","students control pace, interact with adaptive feedback, and earn mastery rewards.","Pre-tests and post-tests, Student Engagement Instrument (SEI).",Not specified.,
85,2024,"Demedts, F; Kiili, K; Ninaus, M; Lindstedt, A; Reynvoet, B; Sasanguie, D; Depaepe, F",The effectiveness of explanatory adaptive feedback within a digital educational game to enhance fraction understanding,LEARNING AND INSTRUCTION,10.1016/j.learninstruc.2024.101976,students,classroom,game,Number Trace Fraction,"primary school, G4",feedback,,"Adaptive feedback (i.e., feedback generated based on learners' variables)","1. corrective feedback or explanatory adaptive feedback 2. feedback include emotional word 3. adptive as it give different feedback based on item kind and student operation, 5 feedback are set previoursely and one of them will be given",,Not specified,"System control, immediate feedback after answer each question",,"learning outcomes,  math anxiety, math self-concept, math motivation",Not specified,
